{
  "schema_version": "studio.archetype-template-evaluation.v1",
  "evaluation_id": "eval_creative_portfolio_inquiry_v1",
  "archetype_id": "creative-portfolio-inquiry",
  "template_ref": "templates/archetypes/creative-portfolio-inquiry-master.v1.md",
  "source_ids": ["src_w3c_wcag22", "src_awwwards_evaluation", "src_cssda_gallery", "src_uncommon_case"],
  "scores": {
    "decision_clarity": 3,
    "buyer_confidence": 3,
    "action_path": 3,
    "accessibility": 3,
    "performance": 2,
    "archetype_fit": 4,
    "craft_and_distinctiveness": 4,
    "maintainability": 3
  },
  "normative_gates_passed": false,
  "functional_gates_passed": false,
  "human_test_completed": false,
  "human_reviewed": false,
  "decision": "candidate",
  "rationale": "The curation and inquiry boundary are explicit, but portfolio rights, responsive media weight, motion alternatives, buyer fit, and a working inquiry route remain untested and unreviewed.",
  "reviewed_by": null,
  "reviewed_on": null
}
